grade,subject,unit,topic,skill,question,option1,correct1,option2,correct2,option3,correct3,option4,correct4,remarks
11,Physics,"Work and Energy","Work and Energy",Work,"The dot product of force and displacement is called __________.",Energy,N,"Work done",Y,Power,N,Torque,N,"Correct answer is ""Work done"""
11,Physics,"Work and Energy","Work and Energy",Work,"The work done by the centripetal force is always ________.",Positive,N,Negative,N,Zero,Y,"None of these",N,"Correct answer is ""Zero"""
11,Physics,"Work and Energy","Work and Energy",Work,"When a force acting on a body displaces it in the direction of a force then, __________.","uniform velocity occurs",N,"uniform speed occurs",N,"work is done",Y,"equilibrium take place",N,"Correct answer is ""work is done"""
11,Physics,"Work and Energy","Work and Energy",Work,"If a box is pulled by a rope making an angle with the surface, then the horizontal component of force is equal to ______.","F sinθ",N,"F cosθ",Y,"F tanθ",N,"None of the above",N,"Correct answer is ""F cosθ"""
11,Physics,"Work and Energy","Work and Energy",Work,"1 joule is equal to _____.","1 N × 1 m",Y,"1 N + 1 m",N,"1 N - 1 m",N,"1 N / 1 m",N,"Correct answer is ""1 N × 1 m"""
11,Physics,"Work and Energy","Work and Energy",Work,"A force of 100 N moves a crate 10 m on the horizontal road. The work done is ______.","1 J",N,"150 J",N,"100 J",N,"1000 J",Y,"Correct answer is ""1000 J"""
11,Physics,"Work and Energy","Work and Energy",Work,"The work done is 0 if:","The body shows displacement in the opposite direction of the force applied.",N,"The body shows displacement in the same direction as that of the force applied.",N,"The body shows a displacement in perpendicular direction to the force applied.",Y,"The body masses obliquely to the direction of the force applied.",N,"Correct answer is ""The body shows a displacement in perpendicular direction to the force applied."""
11,Physics,"Work and Energy","Work and Energy",Work,"When can one say that work is done on the body?","When the body experiences force",N,"When there is an increase in energy because of mechanical influence.",N,"When the body moves a certain distance by the application of force",Y,"None of the above",N,"Correct answer is ""When the body moves a certain distance by the application of force"""
11,Physics,"Work and Energy","Work and Energy",Work,"If a body a mass of 2kg is raised vertically through 2m, then the work done will be","38.2 J",N,"392.1 J",N,"39.2 J",Y,"3.92 J",N,"Correct answer is ""39.2 J"""
11,Physics,"Work and Energy","Work and Energy",Work,"Work is defined as","Scalar product of force and displacement",Y,"Vector product of force and displacement",N,"Scalar product of force and velocity",N,"Vector product of force and velocity",N,"Correct answer is ""Scalar product of force and displacement"""
11,Physics,"Work and Energy","Work and Energy",Work,"The work given to the machine is called",Input,Y,Output,N,"Velocity ratio",N,"Mechanical advantage",N,"Correct answer is ""Input"""
11,Physics,"Work and Energy","Work and Energy",Work,"All of them are true except:","Work is defined as the product of force & distance",N,"Joule is the unit of work",N,"Work always takes place in the direction of force",N,"Work is negative when force and distance are perpendicular to each other",Y,"Correct answer is ""Work is negative when force and distance are perpendicular to each other"""
11,Physics,"Work and Energy","Work and Energy",Work,"The amount of work done when a power of one kilowatt is maintained for one hour is called",kilowatt-hr,Y,watt-hr,N,joule-hr,N,"joules per hr",N,"Correct answer is ""kilowatt-hr"""
11,Physics,"Work and Energy","Work and Energy",Work,"The work done in lifting 30kg of brick to a height of 20m is","2800 J",N,"600 J",N,"5880 J",Y,"2910 J",N,"Correct answer is ""5880 J"""
11,Physics,"Work and Energy","Work and Energy",Work,"The work done in moving an object along a vector r = 3i + 2j – 5k. If the applied force is F = 2i – j – k","10 J",N,"(6i – 2j – 5k)  J",N,"9.8 J",N,9J,Y,"Correct answer is ""9J"""
11,Physics,"Work and Energy","Work and Energy",Work,"Work is a _________ quantity.",Scalar,Y,Vector,N,Phasor,N,Tensor,N,"Correct answer is ""Scalar"""
11,Physics,"Work and Energy","Work and Energy",Work,"The device which helps in doing work is known as:",Barometer,N,Potentiometer,N,Worker,N,Machine,Y,"Correct answer is ""Machine"""
11,Physics,"Work and Energy","Work and Energy",Work,"If the force and displacement are at right angle to each other, then the work done will be __________.",Zero,Y,Maximum,N,Minimum,N,Negative,N,"Correct answer is ""Zero"""
11,Physics,"Work and Energy","Work and Energy",Work,"Which of the following condition is necessary for Positive Work?","\(0{^\circ}\  \leq \ \theta\  \leq \ 90{^\circ}\)",N,"\(90{^\circ}\  \leq \ \theta\  \leq \ 0{^\circ}\)",N,"\(0{^\circ}\  \leq \ \theta\  < \ 90{^\circ}\)",Y,"\(\ 0{^\circ}\  < \ \theta < \ 90{^\circ}\)",N,"Correct answer is ""\(0{^\circ}\  \leq \ \theta\  < \ 90{^\circ}\)"""
11,Physics,"Work and Energy","Work and Energy",Work,"Which of the following condition is necessary for Negative Work?","\(90{^\circ}\  \leq \ \theta\  \leq \ 180{^\circ}\)",N,"\(90{^\circ}\  < \ \theta\  \leq \ 180{^\circ}\)",Y,"\(90{^\circ}\  \leq \ \theta < \ 180{^\circ}\)",N,"\(90{^\circ}\  < \ \theta < \ 180{^\circ}\)",N,"Correct answer is ""\(90{^\circ}\  < \ \theta\  \leq \ 180{^\circ}\)"""
11,Physics,"Work and Energy","Work and Energy",Work,"Which of the following situations are examples of Negative Work?","Friction stopping a sliding object",N,"Car brakes slowing down Car to zero speed",N,"A child pushing a shopping cart",N,"Both ‘a’ and ‘b’",Y,"Correct answer is ""Both ‘a’ and ‘b’"""
11,Physics,"Work and Energy","Work and Energy",Work,"What is the condition for maximum work?","\(0{^\circ}\  \leq \ \theta < 90{^\circ}\)",N,"\(\theta = 0{^\circ}\)",Y,"\(\theta = 90{^\circ}\)",N,"None of these",N,"Correct answer is ""\(\theta = 0{^\circ}\)"""
11,Physics,"Work and Energy","Work and Energy",Work,"When the direction of force is opposite to the direction of displacement, then the work done will be:",Positive,N,Negative,Y,Zero,N,"None of these",N,"Correct answer is ""Negative"""
11,Physics,"Work and Energy","Work and Energy",Work,"When the direction of force is parallel to the direction of displacement, then the work done will be:",Positive,Y,Negative,N,Zero,N,"None of these",N,"Correct answer is ""Positive"""
11,Physics,"Work and Energy","Work and Energy",Work,"When the direction of force is perpendicular to the direction of displacement, then the work done will be:",Positive,N,Negative,N,Zero,Y,"None of these",N,"Correct answer is ""Zero"""
11,Physics,"Work and Energy","Work and Energy",Work,"The work done is 0 if:","The body shows displacement in the opposite direction of the force applied",N,"The body shows displacement in the same direction as that of the force applied",N,"The body shows a displacement in perpendicular direction to the force applied",Y,"The body masses obliquely to the direction of the force applied",N,"Correct answer is ""The body shows a displacement in perpendicular direction to the force applied"""
11,Physics,"Work and Energy","Work and Energy",Work,"A man pushes a lawn mower with a force of 40 N force directed at an angle of 30˚ downward from the horizontal. Find the work done as the man cuts the strip of grass 20 m long.","693 J",Y,"500 J",N,"400 J",N,"1000 J",N,"Correct answer is ""693 J"""
11,Physics,"Work and Energy","Work and Energy",Work,"The work done by centripetal force is?","Equal to that of centrifugal force",N,"Greater than that of centrifugal force",N,"Variable in different cases",N,Zero,Y,"Correct answer is ""Zero"""
11,Physics,"Work and Energy","Work and Energy",Work,"Work is always done in a body when _____________________.","a force acts on it",N,"it covers some displacement",N,"force moves it in its direction or in opposite directions",N,"All of these",Y,"Correct answer is ""All of these"""
11,Physics,"Work and Energy","Work and Energy",Work,"Work done by a body is maximum when angle between force and displacement is ________.","\(90^{o}\)",N,"\(0^{o}\)",Y,"\(180^{o}\)",N,"None of the above",N,"Correct answer is ""\(0^{o}\)"""
11,Physics,"Work and Energy","Work and Energy",Work,"\(Cos\ (180{^\circ} - \theta)\) = ______________. ","\(\text{sinθ}\)",N,"\(cos\ ( - \theta)\)",N,"\(- cos\theta\)",Y,0,N,"Correct answer is ""\(- cos\theta\)"""
11,Physics,"Work and Energy","Work and Energy",Work,"The unit of work in terms of power is_________.",Watt,N,Joule,N,KWH,Y,Second,N,"Correct answer is ""KWH"""
